objectid,filename,youtubeid,vimeoid,title,creator,date,description,subject,location,latitude,longitude,source,identifier,type,format,language,rights,rightsstatement
tix_icon_original_001,tix_icon_original.png,,,Original Tickets (Tix) Icon,Roblox Corporation ,2007-2014,"The orginal icon for Tickets (Tix), Roblox's former free currency system. This icon represented Tix from its introduction in 2007 until its redesign in 2014.",Tix;Economy;Currency;Interface;Early Roblox,,,,Roblox Wiki,,Image;StillImage,image/png,eng,Screenshot from public forum use for educational and archival purposes,http://rightsstatements.org/vocab/NoC-US/1.0/
tix_icon_modern_002,tix_icon_modern.png,,,Modern Tickets (Tix) Icon ,Roblox Corporation ,   2014-2016,"The redesigned icon for Tickets (Tix), used in the final years before the currency was discontinued in 2016.",Tix;Economy;Currency;Interface;Redesign,,,,Roblox Wiki,,Image;StillImage,image/png,eng,Screenshot from public forum use for educational and archival purposes,http://rightsstatements.org/vocab/NoC-US/1.0/
roblex_exchange_003,roblex_exchange.png,,,RoblEX Currency Exchange System,Roblox Corporation ,2007-2016,"RoblEX (Currency Exchange) allowed users to trade tickets (Tix) for Robux and vice versa, forming a player-driven economy based on supply and demand.",Tix;Robux;Economy;RoblEX;Currency Exchange,,,,Roblox Wiki,,Image;StillImage,image/png,eng,Screenshot from public forum use for educational and archival purposes,http://rightsstatements.org/vocab/NoC-US/1.0/
tix_removal_official_blog_004,tix_removal_blog.png,,,Saying Goodbye to Tickets (Official Announcement),Roblox Corporation ,2016,"Official Roblox blog post announcing the discontinuation of Tickets (Tix), explaining reasons including product simplification, botting prevention, and changes to the virtual economy.",Tix;Economy;Policy Change;Announcement;Roblox Blog,,,,Blogspot,,Image;StillImage,image/png,eng,Screenshot from public forum use for educational and archival purposes,http://rightsstatements.org/vocab/NoC-US/1.0/
tix_nostalgia_reddit_005,tix_nostalgia_reddit.png,,,Community Nostalgia for Roblox Tickets (Tix),Reddit User (r/roblox community),2024,"Reddit post reflecting on the removal of Roblox Tickets (Tix), expressing nostalgia for the currency and its role in avatar customization and daily engagement. Includes community imagery referencing a symbolic “grave of Tix.",Tix;Nostalgia;Community Memory;Roblox Economy;Digital Culture,,,,Reddit (r/roblox),,Image;StillImage,image/png,eng,Screenshot from public forum use for educational and archival purposes,http://rightsstatements.org/vocab/NoC-US/1.0/
tixapalooza_2016_006,tixapalooza.png,,,Tixapalooza Farewell Event,Roblox Corporation ,2016,"Tixapalooza was a month-long farewell event held before the discontinuation of Tickets (Tix). From March 15 to April 13, 2016, Roblox released exclusive Ticket-themed commemorative items that allowed users to spend their remaining Tix balances before the currency was removed.",Tix;Events;Commemorative Items;Digital Economy;Roblox History,,,,Roblox Wiki,,Image;StillImage,image/png,eng,Screenshot from public forum use for educational and archival purposes,http://rightsstatements.org/vocab/NoC-US/1.0/
guest_first_appearance_2008_007,guest_first_appearance_2008.png,,,First Guest Appearance,Roblox Corporation ,2008,Early guest avatar used by unregistered players shortly after the introduction of Guest Mode in 2008. The avatar featured the traditional noob color scheme and allowed new users to experience Roblox without creating an account.,guest accounts;avatars;new users;platform onboarding;user identity,,,,Roblox Wiki,,Image;StillImage,image/png,eng,Screenshot from public forum use for educational and archival purposes,http://rightsstatements.org/vocab/NoC-US/1.0/
male_guest_008,male_guest.png,,,BillyBloxxer Guest Avatar,Roblox Corporation,2016-2017,"Male guest avatar used on Roblox following the September 2016 guest avatar redesign. BillyBloxxer represented unregistered users who selected the male guest option before entering games. The avatar featured the Robloxian 2.0 body package, True Blue Hair, a Roblox jacket, jeans, and sneakers.",guest accounts;BillyBloxxer;avatars;user onboarding;unregistered users;Robloxian 2.0,,,,Roblox Wiki,,Image;StillImage,image/png,eng,Screenshot from public forum use for educational and archival purposes,http://rightsstatements.org/vocab/NoC-US/1.0/
female_guest_009,female_guest.png,,,BettyBloxxer Guest Avatar,Roblox Corporation,2016-2017,"Female guest avatar used on Roblox following the September 2016 guest avatar redesign. BettyBloxxer represented unregistered users who selected the female guest option before entering games. The avatar featured the Robloxian 2.0 body package, Lavender Updo Hair, a Roblox jacket, jeans, and sneakers.",guest accounts;BettyBloxxer;avatars;user onboarding;unregistered users;Robloxian 2.0,,,,Roblox Wiki,,Image;StillImage,image/png,eng,Screenshot from public forum use for educational and archival purposes,http://rightsstatements.org/vocab/NoC-US/1.0/
play_as_guest_popup_2012_010,play_as_guest_popup_2012.png,,,Play as Guest Popup,Roblox Corporation,2012-2017,"Interface and access-layer artifact showing the “Play as Guest” entry system used on Roblox between 2012 and 2017. This popup allowed unregistered users to enter games without creating an account and functioned as a key onboarding gateway into the platform.This artifact represents the guest access layer of the Roblox platform, where identity was temporarily assigned at login rather than permanently registered.",guest accounts;interface design;user onboarding;access layer;Play as Guest;Roblox login system;unregistered users,,,,Roblox Wiki,,Image;StillImage,image/png,eng,Screenshot from public forum use for educational and archival purposes,http://rightsstatements.org/vocab/NoC-US/1.0/
guest_nametag_011,guest_nametag.png,,,Guest Nametag,Roblox Corporation,2008-2017,"In-game nametag used to identify unregistered players on Roblox servers. Guests appeared under the generic label “Guest” followed by a randomly assigned number, making them visually distinct from registered users. This nametag functioned as a temporary identity system, reinforcing Guest status as a non-persistent account type within gameplay environments.",guest accounts;nametags;player identity;UI overlay;unregistered users;in-game interface,,,,Roblox Wiki,,Image;StillImage,image/png,eng,Screenshot from public forum use for educational and archival purposes,http://rightsstatements.org/vocab/NoC-US/1.0/
guest_safe_chat_012,guest_safe_chat_2013.png,,,Guest Safe Chat Interface,Roblox Corporation,2013,"Screenshot showing the communication restrictions applied to Guest accounts on Roblox in November 2013. Guests were limited to Super Safe Chat, a menu-based communication system that prevented free-text messaging and restricted interactions to pre-approved phrases. This artifact documents Roblox's moderation and safety policies for unregistered users, illustrating how communication was controlled within the platform's guest access system.",guest accounts;safe chat;Super Safe Chat;communication;moderation;child safety;user restrictions;unregistered users,,,,Roblox Wiki,,Image;StillImage,image/png,eng,Screenshot from public forum use for educational and archival purposes,http://rightsstatements.org/vocab/NoC-US/1.0/
removal_of_guest_mode_announcement_013,removal_of_guest_mode_announcement.png,,,Removal of Guest Mode Announcement,,2017,"Official announcement published on the Roblox Developer Forum documenting the discontinuation of Guest Mode on both desktop and mobile platforms. Roblox stated that requiring users to create registered accounts would improve player retention, social interaction, game engagement, and monetization opportunities for developers. This artifact marks the end of guest access on Roblox and reflects the platform's transition toward account-based participation and community engagement.",guest accounts;feature removal;platform policy;user registration;developer relations;community management;account systems,,,,Roblox Wiki,,Image;StillImage,image/png,eng,Screenshot from public forum use for educational and archival purposes,http://rightsstatements.org/vocab/NoC-US/1.0/